{
  "schema": "trecap_phase2_de1soc_board_top_integration_v1",
  "file_class": "[1] hand-written Step-9 board-top integration contract",
  "project": "T_RECAP_Phase2",
  "board": "de1soc",
  "contract_stage": "step9_board_top_scaffolds_replaced_source_implemented",
  "status": "source_implemented_pending_rtl_compile_functional_verification_platform_designer_generation_quartus_and_hardware_evidence",
  "implementation_state": {
    "board_top_scaffolds_replaced": true,
    "generated_platform_designer_csr_path_bound": true,
    "generated_platform_designer_ddr_path_bound": true,
    "audio_linein_to_source_core_bound": true,
    "adc_capture_to_source_core_bound": true,
    "core_y_to_best_effort_audio_lineout_bound": true,
    "ltc2308_capture_and_config_path_bound": true,
    "real_board_status_bound": true,
    "rtl_compile": false,
    "functional_verification": false,
    "platform_designer_generation": false,
    "quartus_compile": false,
    "hardware_signoff": false
  },
  "source_ownership": {
    "physical_board_top": "rtl/platform/de1soc/de1_soc_trecap_top.sv",
    "clock_reset_controller": "rtl/platform/de1soc/clock_reset_ctrl.sv",
    "platform_designer_boundary": "rtl/platform/de1soc/platform_designer_wrapper.sv",
    "generated_platform_designer_module": "system",
    "audio_platform_wrapper": "rtl/platform/de1soc/audio_codec_wrapper.sv",
    "adc_platform_wrapper": "rtl/platform/de1soc/adc_wrapper.sv",
    "source_core_integration": "rtl/top/trecap_source_core_integration.sv",
    "telemetry_hps_integration": "rtl/top/trecap_de1soc_full_top.sv",
    "full_board_filelist": "filelists/rtl_de1soc_full.f",
    "quartus_filelist": "filelists/quartus_de1soc.qsf.inc"
  },
  "board_composition": {
    "physical_top_module": "de1_soc_trecap_top",
    "required_instances": {
      "clock_reset_ctrl": "u_clock_reset_ctrl",
      "platform_designer_wrapper": "u_platform_designer_wrapper",
      "audio_codec_wrapper": "u_audio_codec_wrapper",
      "adc_wrapper": "u_adc_wrapper",
      "trecap_source_core_integration": "u_source_core_integration",
      "trecap_de1soc_full_top": "u_full_top"
    },
    "instances_per_required_type": 1,
    "direct_trecap_core_top_instances": 0,
    "trecap_core_telemetry_top_instances": 0,
    "mathematical_core_owner": "trecap_source_core_integration",
    "telemetry_hps_owner": "trecap_de1soc_full_top",
    "fabric_clock": "clk_fabric",
    "platform_reset": "rst_n_platform"
  },
  "clock_reset_scaffold_contract": {
    "active_fabric_clock_source": "CLOCK_50",
    "active_fabric_clock_domain_count": 1,
    "canonical_reset_owner": "clock_reset_ctrl",
    "canonical_reset_output": "rst_n_platform",
    "physical_reset_source": "KEY[0]",
    "board_reset_release_qualification_cycles": 1000000,
    "hps_reset_source": "h2f_reset_n",
    "canonical_reset_combination": "qualified_KEY0_and_h2f_reset_n",
    "board_top_reset_synchronizer_permitted": false,
    "pseudo_clock_domain_outputs_permitted": false,
    "pseudo_reset_domain_outputs_permitted": false,
    "tick_generation": "fractional_accumulator_clock_enables",
    "ticks_used_as_clocks_permitted": false,
    "audio_rx_reset_sync_instance": "u_bclk_rx_reset_sync",
    "audio_tx_reset_sync_instance": "u_bclk_tx_reset_sync",
    "audio_rx_reset_release_edge": "posedge_AUD_BCLK",
    "audio_tx_reset_release_edge": "negedge_AUD_BCLK",
    "synthetic_frame_boundary_output_permitted": false,
    "synthetic_source_safe_boundary_output_permitted": false,
    "real_frame_boundary_owner": "trecap_source_core_integration",
    "real_source_safe_boundary_owner": "trecap_source_core_integration",
    "direct_clock_baseline_claims_pll_lock": false,
    "reset_may_depend_on_hardwired_pll_locked_true": false
  },
  "platform_designer_paths": {
    "generated_instance": "platform_designer_wrapper.u_platform_designer_system",
    "csr_path": [
      "HPS lightweight bridge",
      "generated system CSR Avalon master",
      "platform_designer_wrapper CSR boundary",
      "trecap_de1soc_full_top CSR slave",
      "trecap_hps_bridge_top",
      "trecap_avmm_csr_adapter",
      "trecap_csr_bank"
    ],
    "ddr_path": [
      "trecap_ddr_ring_writer",
      "trecap_de1soc_full_top Avalon write master",
      "platform_designer_wrapper DDR boundary",
      "generated system F2SDRAM Avalon slave",
      "HPS DDR3"
    ],
    "csr_request_and_response_bound_end_to_end": true,
    "ddr_write_request_and_response_bound_end_to_end": true,
    "safe_idle_csr_substitute_permitted": false,
    "safe_idle_ddr_substitute_permitted": false,
    "local_generated_system_stub_permitted": false
  },
  "source_core_telemetry_paths": {
    "audio_linein_path": [
      "AUD_ADCDAT/AUD_ADCLRCK/AUD_BCLK",
      "audio_codec_wrapper",
      "trecap_source_core_integration audio inputs",
      "trecap_core_top"
    ],
    "adc_capture_path": [
      "ADC_DOUT",
      "adc_wrapper",
      "trecap_source_core_integration ADC inputs",
      "trecap_core_top"
    ],
    "core_observation_path": [
      "trecap_source_core_integration real core taps and counters",
      "trecap_de1soc_full_top",
      "trecap_telemetry_top",
      "trecap_hps_bridge_top",
      "trecap_ddr_ring_writer"
    ],
    "core_y_lineout_monitor_path": [
      "trecap_source_core_integration y stream",
      "non-stalling best-effort audio lineout monitor",
      "AUD_DACDAT/AUD_DACLRCK"
    ],
    "core_y_ready_owner": "always_accept_non_stalling_board_sink",
    "audio_lineout_backpressure_to_core_permitted": false,
    "audio_lineout_busy_action": "drop_monitor_sample_and_count_tx_overflow",
    "audio_lineout_enable_propagated_to_bclk_domain": true,
    "stale_enabled_lineout_after_disable_permitted": false,
    "audio_lineout_ready_is_observability_only": true,
    "core_y_audio_scale_rule": "signed_left_shift_by_AUDIO_SAMPLE_W_minus_T_SAMPLE_W",
    "core_y_audio_channel_mapping": "dual_mono_left_and_right",
    "audio_xck_policy": "pll_generated_12_288_MHz_lock_qualified_codec_init",
    "audio_xck_source_until_reviewed_pll": "audio_pll_wrapper.audio_mclk_o",
    "enableable_ad_hoc_xck_debug_divider_permitted": false,
    "audio_live_ready_claimed": false,
    "core_y_constant_or_disconnected_board_tieoff_permitted": false,
    "synthetic_tap_generation_permitted": false,
    "telemetry_ready_to_core_permitted": false,
    "adc_configuration_constant_tieoff_permitted": false,
    "adc_explicit_request_may_be_inactive_when_continuous_mode_is_active": true,
    "audio_lineout_constant_tieoff_permitted": false
  },
  "ltc2308_board_contract": {
    "device_family": "LTC2308",
    "board_signal_alias": "ADC_CS_N_is_CONVST",
    "conversion_input_range_volts": "0_to_4.096",
    "conversion_start": "short_active_high_CONVST_pulse_idle_low",
    "minimum_post_convst_wait_us": "1.6",
    "serial_data_bits_per_result": 12,
    "next_configuration_bits": 6,
    "configuration_source": "sw_sync[6:4]",
    "configuration_latch_point": "entry_to_TSRC_ADC_LIVE",
    "configuration_stable_for_active_source_epoch": true,
    "configuration_update_requires_leave_and_reenter": true,
    "mid_epoch_channel_mixing_permitted": false,
    "new_adc_source_epoch_requires_reprime": true,
    "sampling_mode_select": "sw_sync[7]",
    "manual_request_source": "key_press_pulse[2]",
    "configuration_shifted_while_reading_previous_result": true,
    "first_result_after_enable_or_channel_change": "prime_and_discard_old_configuration_result",
    "sample_valid_only_after_primed_current_configuration": true,
    "adc_wrapper_owns_protocol_timing": true,
    "continuous_scheduler_kind": "exact_average_fractional_phase_accumulator",
    "continuous_scheduler_rate_hz": 100000,
    "continuous_scheduler_interval_jitter_max_fabric_cycles": 1,
    "integer_period_scheduler_permitted": false,
    "timing_parameters_validated_against_clk_hz_with_wide_arithmetic": true,
    "compile_time_timing_assertions_required": true,
    "literal_default_cycles_as_only_timing_proof_permitted": false
  },
  "board_status_path": {
    "led_outputs": "LEDR",
    "seven_segment_outputs": [
      "HEX0",
      "HEX1",
      "HEX2",
      "HEX3",
      "HEX4",
      "HEX5"
    ],
    "status_sources": [
      "platform reset and heartbeat",
      "real core sample and frame counters",
      "real core tap activity",
      "telemetry activity and pre-writer drop status",
      "DDR writer/ring status",
      "source/core/platform wrapper faults"
    ],
    "synthetic_activity_counter_permitted": false,
    "constant_status_display_permitted": false
  },
  "filelist_contract": {
    "full_board_top_listed_once": true,
    "platform_wrappers_listed_once": true,
    "source_core_precedes_board_top": true,
    "telemetry_hps_precedes_board_top": true,
    "standalone_core_telemetry_composition_excluded": true,
    "generated_system_hdl_owned_by_vendor_generation": true
  },
  "evidence_policy": {
    "source_checker": "scripts/check_de1soc_board_top.py",
    "human_document": "docs/architecture/de1soc_board_top_integration.md",
    "schema_file": "spec/schemas/de1soc_board_top_integration.schema.json",
    "default_checker_scope": "source_only",
    "source_check_is_rtl_compile": false,
    "source_check_is_functional_verification": false,
    "source_check_is_platform_designer_generation": false,
    "source_check_is_quartus_compile": false,
    "source_check_is_hardware_signoff": false
  },
  "validation_rules": [
    "The physical board top shall instantiate each required board, Platform Designer, source/core, and telemetry/HPS owner exactly once.",
    "The board hierarchy shall contain one mathematical core through trecap_source_core_integration and shall not instantiate the standalone core plus telemetry composition.",
    "The generated Platform Designer CSR request and response channels shall bind through the hand-written wrapper to trecap_de1soc_full_top without a safe-idle substitute.",